<?xml version="1.0" encoding="UTF-8"?>
<!DOCTYPE maf-resource PUBLIC "-//UBQ//DTD maf-command config XML V1.0//EN" "resourceBundle.dtd">

<bundle defaultLocale="ko">
  <resource key="appr_dt" type="text">
    <message locale="en" value="Approval date" />
    <message locale="ko" value="승인일" />
  </resource>
  <resource key="btn.attend_insert" type="text">
    <message locale="en" value="Insert" />
    <message locale="ko" value="출석체크" />
  </resource>
  <resource key="btn.mail_send" type="text">
    <message locale="en" value="Send mail" />
    <message locale="ko" value="메일발송" />
  </resource>
  <resource key="btn.score_insert" type="text">
    <message locale="en" value="Save score (grade)" />
    <message locale="ko" value="점수저장" />
  </resource>
  <resource key="itm_id" type="text">
    <message locale="en" value="Contents ID" />
    <message locale="ko" value="컨텐츠id" />
  </resource>
  <resource key="itm_title" type="text">
    <message locale="en" value="Title" />
    <message locale="ko" value="제목" />
  </resource>
  <resource key="mail" type="text">
    <message locale="en" value="Mail" />
    <message locale="ko" value="메일" />
  </resource>
  <resource key="off_score" type="text">
    <message locale="en" value="Offline Score" />
    <message locale="ko" value="출석점수" />
  </resource>
  <resource key="prf_chk" type="text">
    <message locale="en" value="Instructor attendance check" />
    <message locale="ko" value="강사출석체크" />
  </resource>
  <resource key="req_num" type="text">
    <message locale="en" value="Number of applicants" />
    <message locale="ko" value="신청자수" />
  </resource>
  <resource key="seq_no" type="text">
    <message locale="en" value="No." />
    <message locale="ko" value="일련번호" />
  </resource>
  <resource key="user_chk" type="text">
    <message locale="en" value="User attendance check" />
    <message locale="ko" value="사용자출석체크" />
  </resource>
</bundle>