<?xml version="1.0" encoding="UTF-8"?>
<!DOCTYPE maf-resource PUBLIC "-//Miranet//DTD maf-command config XML V1.0//EN" "resourceBundle.dtd">

<bundle defaultLocale="en">
  <resource key="cert_lvl" type="text">
    <message locale="en" value="Certification Level" />
    <message locale="ko" value="인증레벨" />
  </resource>
  <resource key="crs_cd" type="text">
    <message locale="en" value="Course ID" />
    <message locale="ko" value="과정ID" />
  </resource>
  <resource key="crs_nm" type="text">
    <message locale="en" value="Course Name" />
    <message locale="ko" value="과정명" />
  </resource>
  <resource key="crs_short_nm" type="text">
    <message locale="en" value="Abbreviated course name" />
    <message locale="ko" value="과정명약칭" />
  </resource>
  <resource key="ctype" type="text">
    <message locale="en" value="Course Type" />
    <message locale="ko" value="과정유형" />
  </resource>
  <resource key="dlr_cd" type="text">
    <message locale="en" value="Dealer Code" />
    <message locale="ko" value="딜러코드" />
  </resource>
  <resource key="field" type="text">
    <message locale="en" value="Course Classification" />
    <message locale="ko" value="과정구분" />
  </resource>
  <resource key="is_autocerti" type="text">
    <message locale="en" value="Automatic Certification" />
    <message locale="ko" value="자동인증여부" />
  </resource>
  <resource key="isuse" type="text">
    <message locale="en" value="Usage" />
    <message locale="ko" value="사용여부" />
  </resource>
  <resource key="orgn_cd" type="text">
    <message locale="en" value="Organization Code" />
    <message locale="ko" value="조직코드" />
  </resource>
  <resource key="otype" type="text">
    <message locale="en" value="On/Off Type" />
    <message locale="ko" value="온오프구분" />
  </resource>
  <resource key="passcondition" type="text">
    <message locale="en" value="Course completion condition" />
    <message locale="ko" value="수료조건" />
  </resource>
  <resource key="precondition" type="text">
    <message locale="en" value="Course application condition" />
    <message locale="ko" value="선수조건" />
  </resource>
  <resource key="section" type="text">
    <message locale="en" value="Job Domain" />
    <message locale="ko" value="업무영역" />
  </resource>
  <resource key="test_type" type="text">
    <message locale="en" value="Exam Type" />
    <message locale="ko" value="시험유형" />
  </resource>
   <resource key="vc_type" type="text">
    <message locale="en" value="Passenger/Commercial" />
    <message locale="ko" value="승용/상용구분" />
  </resource>
</bundle>