<?xml version="1.0" encoding="UTF-8"?>
<!DOCTYPE maf-resource PUBLIC "-//Miranet//DTD maf-command config XML V1.0//EN" "resourceBundle.dtd">

<bundle defaultLocale="en">
  <resource key="batchupload" type="text">
    <message locale="en" value="File registration - group" />
    <message locale="ko" value="일괄파일등록" />
  </resource>
  <resource key="cencode" type="text">
    <message locale="en" value="-" />
    <message locale="ko" value="중단원 코드" />
  </resource>
  <resource key="cenname" type="text">
    <message locale="en" value="-" />
    <message locale="ko" value="중단원 명" />
  </resource>
  <resource key="cmpcode" type="text">
    <message locale="en" value="Contents" />
    <message locale="ko" value="컨텐츠" />
  </resource>
  <resource key="cnt_height" type="text">
    <message locale="en" value="-" />
    <message locale="ko" value="화면높이" />
  </resource>
  <resource key="cnt_width" type="text">
    <message locale="en" value="-" />
    <message locale="ko" value="화면넓이" />
  </resource>
  <resource key="daecode" type="text">
    <message locale="en" value="Chapter code" />
    <message locale="ko" value="차시코드" />
  </resource>
  <resource key="daename" type="text">
    <message locale="en" value="Chapter name" />
    <message locale="ko" value="차시명" />
  </resource>
  <resource key="dlr_cd" type="text">
    <message locale="en" value="-" />
    <message locale="ko" value="딜러코드" />
  </resource>
  <resource key="excel" type="text">
    <message locale="en" value="Excel file registration" />
    <message locale="ko" value="엑셀파일등록" />
  </resource>
  <resource key="htmcode" type="text">
    <message locale="en" value="Serial number" />
    <message locale="ko" value="일련번호" />
  </resource>
  <resource key="htmname" type="text">
    <message locale="en" value="-" />
    <message locale="ko" value="파일명" />
  </resource> 
  <resource key="htmurl" type="text">
    <message locale="en" value="Contents URL" />
    <message locale="ko" value="컨텐츠URL" />
  </resource>
  <resource key="impdat" type="text">
    <message locale="en" value="Registration date" />
    <message locale="ko" value="등록일" />
  </resource>
  <resource key="isuse" type="text">
    <message locale="en" value="Used" />
    <message locale="ko" value="사용여부" />
  </resource>
  <resource key="lrntime" type="text">
    <message locale="en" value="Minimum training time" />
    <message locale="ko" value="최소학습시간" />
  </resource>
  <resource key="orgn_cd" type="text">
    <message locale="en" value="-" />
    <message locale="ko" value="조직코드(대리점)" />
  </resource>
  <resource key="popup_size" type="text">
    <message locale="en" value="Pop up window size" />
    <message locale="ko" value="팝업창크기" />
  </resource>
  <resource key="review" type="text">
    <message locale="en" value="Preview" />
    <message locale="ko" value="미리보기" />
  </resource>
  <resource key="script.msg1" type="text">
    <message locale="en" value="Please input course code" />
    <message locale="ko" value="☞ 과정코드를 입력하세요." />
  </resource>
  <resource key="script.msg10" type="text">
    <message locale="en" value="Please register files with file type ({0})" />
    <message locale="ko" value="※ 등록할 파일의 확장자는 ({0})로 만들어진 파일을 등록하세요." />
  </resource>
  <resource key="script.msg11" type="text">
    <message locale="en" value="Please select the correct file corresponding to the standard" />
    <message locale="ko" value="☞ 기준에 맞는 정확한 파일을 선택하세요." />
  </resource>
  <resource key="script.msg2" type="text">
    <message locale="en" value="Please input course name" />
    <message locale="ko" value="☞ 과정명을 입력하세요." />
  </resource>
  <resource key="script.msg3" type="text">
    <message locale="en" value="Please select subject" />
    <message locale="ko" value="☞ 과목을 선택하세요." />
  </resource>
  <resource key="script.msg4" type="text">
    <message locale="en" value="-" />
    <message locale="ko" value="☞ 대단원코드를 입력하세요." />
  </resource>
  <resource key="script.msg5" type="text">
    <message locale="en" value="-" />
    <message locale="ko" value="☞ 대단원명을 입력하세요." />
  </resource>
  <resource key="script.msg6" type="text">
    <message locale="en" value="파일을 입력한다?" />
    <message locale="ko" value="☞ 시작HTM파일명은 (htm, 또는 html)로 만들어진 파일을 입력하세요." />
  </resource>
  <resource key="script.msg7" type="text">
    <message locale="en" value="Please input pop up window size" />
    <message locale="ko" value="☞ 팝업윈도의 창 크기를 입력해주세요." />
  </resource>
  <resource key="script.msg8" type="text">
    <message locale="en" value="Please input the full path of registered contents" />
    <message locale="ko" value="☞ 등록된 컨텐츠의 full path를 입력해 주세요." />
  </resource>
  <resource key="script.msg9" type="text">
    <message locale="en" value="Please register files with file type (0) or (1)" />
    <message locale="ko" value="※ 등록할 파일의 확장자는 ({0} 또는 {1})로 만들어진 파일을 등록하세요." />
  </resource>
  <resource key="select_subject" type="text">
    <message locale="en" value="Select subject" />
    <message locale="ko" value="과목선택" />
  </resource>
  <resource key="sjtcode" type="text">
    <message locale="en" value="Subject Code" />
    <message locale="ko" value="과목코드" />
  </resource>
  <resource key="sjtname" type="text">
    <message locale="en" value="Subject Name" />
    <message locale="ko" value="과목명" />
  </resource>
  <resource key="socode" type="text">
    <message locale="en" value="Sub course code" />
    <message locale="ko" value="소단원 코드" />
  </resource>
  <resource key="soname" type="text">
    <message locale="en" value="Sub course name" />
    <message locale="ko" value="소단원 명" />
  </resource>
  <resource key="totpage" type="text">
    <message locale="en" value="Total pages" />
    <message locale="ko" value="총페이지수" />
  </resource>
</bundle>