<?xml version="1.0" encoding="UTF-8"?>
<!DOCTYPE maf-command PUBLIC
         "-//Miranet//DTD maf-command config XML V1.0//EN"
         "resourceBundle.dtd">

<bundle defaultLocale="en">
	<resource key="sjt_cd"> 
		<message locale="ko" value="과목코드"/>
		<message locale="en" value="Subject Code"/>
	</resource>
	<resource key="sbj_type">
		<message locale="ko" value="Type"/>
		<message locale="en" value="Type"/>
	</resource>
	
	<resource key="subject_nm">
		<message locale="en" value="Subject Name"/>
		<message locale="ko" value="과목명"/>
	</resource>
	<resource key="name_eng">
		<message locale="ko" value="영문과목명"/>
		<message locale="en" value="Name_eng"/>
	</resource>
	<resource key="isuse">
		<message locale="ko" value="사용여부"/>
		<message locale="en" value="Isuse"/>
	</resource>
	<resource key="stype">
		<message locale="ko" value="과목유형"/>
		<message locale="en" value="Subject Type"/>
	</resource>
	<resource key="otype">
		<message locale="ko" value="온/오프구분"/>
		<message locale="en" value="On/Off"/>
	</resource>
	<resource key="price">
		<message locale="ko" value="교육비"/>
		<message locale="en" value="Price"/>
	</resource>
	<resource key="term">
		<message locale="ko" value="기간"/>
		<message locale="en" value="Term"/>
	</resource>
	<resource key="outline">
		<message locale="ko" value="과목개요"/>
		<message locale="en" value="Outline"/>
	</resource>
	<resource key="target">
		<message locale="ko" value="수강대상"/>
		<message locale="en" value="Target"/>
	</resource>
	<resource key="precondition">
		<message locale="ko" value="선수조건"/>
		<message locale="en" value="Precondition"/>
	</resource>
	<resource key="contents">
		<message locale="ko" value="교육내용"/>
		<message locale="en" value="Contents"/>
	</resource>
	<resource key="level_type">
		<message locale="ko" value="난이도"/>
		<message locale="en" value="Level"/>
	</resource>
	<resource key="ad_new">
		<message locale="ko" value="신규과정"/>
		<message locale="en" value="Ad_new"/>
	</resource>
	<resource key="ad_recommend">
		<message locale="ko" value="추천과정"/>
		<message locale="en" value="Ad_recommend"/>
	</resource>
	<resource key="section">
		<message locale="ko" value="업무영역"/>
		<message locale="en" value="Job Domain"/>
	</resource>
	<resource key="grade">
		<message locale="ko" value="인증등급"/>
		<message locale="en" value="Grade"/>
	</resource>
	<resource key="field">
		<message locale="ko" value="구분"/>
		<message locale="en" value="Field"/>
	</resource>
	<resource key="cert_lvl">
		<message locale="ko" value="인증레벨"/>
		<message locale="en" value="Cert. Level"/>
	</resource>
	<resource key="test_type">
		<message locale="ko" value="테스트유형"/>
		<message locale="en" value="Test_type"/>
	</resource>
	<resource key="division">
		<message locale="ko" value="소속조직"/>
		<message locale="en" value="Division"/>
	</resource>
	<resource key="orgn_cd">
		<message locale="ko" value="조직코드"/>
		<message locale="en" value="Org. Code"/>
	</resource>
	<resource key="dlr_cd">
		<message locale="ko" value="딜러코드"/>
		<message locale="en" value="Dealer Code"/>
	</resource>
	<resource key="year">
		<message locale="ko" value="Year"/>
		<message locale="en" value="Year"/>
	</resource>
	<resource key="attachment">
		<message locale="ko" value="Attachment"/>
		<message locale="en" value="Attachment"/>
	</resource>
	<resource key="currency">
		<message locale="ko" value="지역 유통화폐단위"/>
		<message locale="en" value="Local Currency"/>
	</resource>
	
	<resource key="mandatory">
		<message locale="ko" value="필수"/>
		<message locale="en" value="Mandatory"/>
	</resource>
	<resource key="optional">
		<message locale="ko" value="선택"/>
		<message locale="en" value="Optional"/>
	</resource>

</bundle>
