<?xml version="1.0" encoding="utf-8" ?>
<!DOCTYPE maf-command PUBLIC
         "-//Miranet//DTD maf-command config XML V1.0//EN"
         "resourceBundle.dtd">
<bundle defaultLocale="ko">

	<resource key="target_cd" >
		<message locale="ko" value="목표식별코드" />
		<message locale="en" value="Target_cd" />
	</resource>
	<resource key="grade" >
		<message locale="ko" value="인증구분" />
		<message locale="en" value="Grade" />
	</resource>
	<resource key="section" >
		<message locale="ko" value="업무영역" />
		<message locale="en" value="Section" />
	</resource>
	<resource key="record" >
		<message locale="ko" value="실적" />
		<message locale="en" value="Record" />
	</resource>
	<resource key="record_dt" >
		<message locale="ko" value="실적처리일" />
		<message locale="en" value="Record_dt" />
	</resource>
	<resource key="insert_id" >
		<message locale="ko" value="등록자" />
		<message locale="en" value="Insert_id" />
	</resource>
	<resource key="insert_dt" >
		<message locale="ko" value="등록일" />
		<message locale="en" value="Insert_dt" />
	</resource>
	<resource key="update_id" >
		<message locale="ko" value="수정자" />
		<message locale="en" value="Update_id" />
	</resource>
	<resource key="update_dt" >
		<message locale="ko" value="수정일" />
		<message locale="en" value="Update_dt" />
	</resource>
	
</bundle>